{
  "active_profile_key": "mas_alla_del_guion@1.2.2",
  "dependencies": {},
  "profiles": {
    "mas_alla_del_guion@1.2.2": {
      "active": true,
      "approval_checksum": "c4175417681eb0bc8626a8ae6933cda8cfb3f3645ce138b0e9cdbd59cf59dff9",
      "approval_path": "profiles/editorial/mas_alla_del_guion/1.2.2/functional_approval.json",
      "checksum": "c4175417681eb0bc8626a8ae6933cda8cfb3f3645ce138b0e9cdbd59cf59dff9",
      "compiled_profile_path": "profiles/editorial/mas_alla_del_guion/1.2.2/editorial_profile.json",
      "profile": {
        "audience_hypotheses": [
          {
            "classification": "AUDIENCE_HYPOTHESIS_INITIAL",
            "statement": "Audiencia aproximada de 25 a 45 años; revisable mediante aprendizaje del canal, evidencia de audiencia, evolución editorial, formatos y consumo real.",
            "status": "HYPOTHESIS"
          },
          {
            "classification": "AUDIENCE_HYPOTHESIS_QUALITATIVE",
            "statement": "Adultos hispanohablantes interesados en películas, series, libros, comportamiento humano, cultura y sociedad; buscan profundidad con lenguaje accesible, no requieren formación previa y rechazan coaching, academicismo innecesario, resúmenes extensos, moralización y sensacionalismo.",
            "status": "HYPOTHESIS"
          }
        ],
        "channel_id": "MAS_ALLA_DEL_GUION",
        "external_policy_references": [],
        "functional_owner_role": "CHANNEL_INTELLIGENCE",
        "identity_stable": {
          "authorial_persona": {
            "acts_as": "Un observador con criterio que piensa junto a la audiencia y utiliza historias para conectar experiencias individuales, estructuras sociales y cambios culturales.",
            "does_not_act_as": [
              "terapeuta",
              "gurú",
              "profesor omnisciente",
              "comentarista partidista",
              "crítico tradicional",
              "narrador totalmente neutro"
            ],
            "voice_traits": [
              "pensamiento en movimiento",
              "observación concreta",
              "asociación natural",
              "paso de lo cotidiano a una reflexión amplia",
              "conexión entre individuo y sociedad",
              "memoria y contraste temporal cuando sean relevantes",
              "criterio autoral",
              "claridad",
              "crítica conversacional",
              "ironía suave",
              "autoconciencia",
              "duda honesta",
              "profundidad accesible"
            ]
          },
          "differentiator": [
            "Historia u obra narrativa",
            "conflicto concreto",
            "pregunta humana, social o cultural",
            "investigación",
            "interpretación propia",
            "contraste y matiz",
            "conexión con la realidad",
            "nueva lectura para la audiencia"
          ],
          "editorial_pillars": [
            "Individuo e identidad",
            "Relaciones, familia y generaciones",
            "Sociedad, poder e instituciones",
            "Historia, cultura y nuestro tiempo",
            "Educación emocional"
          ],
          "editorial_purpose": "Utilizar historias y obras narrativas para ayudar a comprender comportamientos humanos, relaciones, estructuras sociales, transformaciones culturales y contradicciones de nuestro tiempo.",
          "first_person_policy": {
            "allowed_uses": [
              "expresar una reacción real",
              "presentar una interpretación propia",
              "reconocer una duda",
              "introducir un recuerdo verdadero",
              "reconocer una contradicción",
              "delimitar una opinión",
              "explicar un cambio de perspectiva"
            ],
            "prohibited_inventions": [
              "experiencias",
              "recuerdos",
              "emociones",
              "opiniones",
              "relación personal con una obra",
              "vulnerabilidad",
              "autoridad autobiográfica"
            ]
          },
          "first_person_rule": "FIRST_PERSON_ALLOWED_WHEN_TRUE_AND_EDITORIALLY_RELEVANT",
          "identity": "Más Allá del Guion crea videoensayos narrativos y contenidos de reflexión que utilizan películas, series y libros para comprender el comportamiento humano, la sociedad y nuestro tiempo.",
          "permanent_limits": [
            "No inventar",
            "No diagnosticar",
            "No sustituir terapia",
            "No hacer coaching",
            "No manipular mediante dolor",
            "No copiar referentes",
            "No presentar hipótesis como hechos",
            "No deformar fuentes",
            "No convertir el canal en noticias generales",
            "No hacer propaganda partidista",
            "No perseguir cualquier tendencia",
            "No resumir obras como producto principal",
            "No utilizar una estructura idéntica en todos los episodios",
            "No sacrificar la tesis por el packaging",
            "No fingir humanidad mediante anécdotas falsas",
            "No confundir claridad con superficialidad",
            "No utilizar investigación sin interpretación propia",
            "No utilizar emoción sin argumento"
          ],
          "positioning": "Canal de videoensayos narrativos y contenidos de reflexión, humanos y accesibles, que parte de películas, series y libros para desarrollar interpretaciones propias sobre las personas, la sociedad y el presente.",
          "primary_promise": "Ayudar al público a comprender qué revelan las historias sobre cómo vivimos, nos relacionamos y construimos sociedad.",
          "purpose": [
            "comportamientos humanos",
            "relaciones",
            "identidad",
            "familia",
            "generaciones",
            "sociedad",
            "poder",
            "instituciones",
            "historia",
            "cultura",
            "tecnología",
            "actualidad",
            "miedo colectivo",
            "educación emocional"
          ],
          "territories": [
            {
              "classification": "ACTIVE",
              "name": "Individuo e identidad"
            },
            {
              "classification": "ACTIVE",
              "name": "Relaciones, familia y generaciones"
            },
            {
              "classification": "ACTIVE",
              "name": "Sociedad, poder e instituciones"
            },
            {
              "classification": "ACTIVE",
              "name": "Historia, cultura y nuestro tiempo"
            },
            {
              "classification": "ACTIVE",
              "name": "Educación emocional"
            },
            {
              "classification": "EXPERIMENTAL",
              "name": "Actualidad interpretada mediante ficción"
            },
            {
              "classification": "EXPERIMENTAL",
              "name": "Episodios con mayor componente histórico o institucional"
            },
            {
              "classification": "EXPERIMENTAL",
              "name": "Historias reales narrativizadas con evidencia y justificación"
            },
            {
              "classification": "EXPERIMENTAL",
              "name": "Aproximaciones editoriales nuevas que mantienen la promesa central"
            },
            {
              "classification": "EXCLUDED",
              "name": "Noticias generales sin puerta narrativa"
            },
            {
              "classification": "EXCLUDED",
              "name": "Política partidista o propaganda"
            },
            {
              "classification": "EXCLUDED",
              "name": "Crítica cinematográfica convencional"
            },
            {
              "classification": "EXCLUDED",
              "name": "Resúmenes como producto principal"
            },
            {
              "classification": "EXCLUDED",
              "name": "Psicología clínica, terapia y coaching"
            },
            {
              "classification": "EXCLUDED",
              "name": "Tendencias sin profundidad editorial"
            },
            {
              "classification": "EXCLUDED",
              "name": "Conspiraciones presentadas como hechos"
            },
            {
              "classification": "EXCLUDED",
              "name": "Explotación morbosa de tragedias"
            },
            {
              "classification": "PENDING",
              "name": "Territorios secundarios aún no aprobados por Inteligencia del Canal"
            }
          ]
        },
        "pending_decisions": [
          "Nuevas muestras auténticas solo podrán incorporarse con checksum, autoría, autorización, representatividad y lineage verificables.",
          "Definir referencias versionadas para políticas editoriales, de plataforma y preferencias de formato fuera de la identidad estable.",
          "Toda nueva versión requerirá aprobación funcional y validación técnica sobre su checksum exacto antes de activarse.",
          "La versión 1.2.2 preserva el contenido funcional vigente y sanea el lineage para depender únicamente de la especificación canónica; requiere aprobación funcional y validación técnica sobre su checksum exacto antes de activarse."
        ],
        "profile_id": "mas_alla_del_guion",
        "source_lineage": [
          {
            "checksum": "899478a6b5be428bca3b8038c3878225f26ae6107aef4f911e69cfe45440265d",
            "locator": "docs/specifications/B3_editorial_profile_functional_specification.md",
            "role": "FUNCTIONAL_SPECIFICATION",
            "source_id": "B3-FUNCTIONAL-SPEC-CANONICAL"
          }
        ],
        "status": "PENDING_FUNCTIONAL_APPROVAL",
        "supported_delivery_formats": [
          "VIDEO_ESSAY",
          "AUDIOVISUAL_NARRATION",
          "NARRATIVE_PODCAST",
          "REFLECTIVE_PODCAST",
          "AUDIO_CONTENT",